<<<<<<< HEAD
<<<<<<< HEAD
<<<<<<< refs/remotes/origin/lineaRober
=======
<!ELEMENT torneo (jornada+)>
<!ATTLIST torneo estado (abierto|cerrado) "abierto">
>>>>>>> lineaRober
<!ELEMENT jornada (partido+)>
<!ATTLIST jornada id CDATA #REQUIRED>
<!ATTLIST jornada fecha CDATA #REQUIRED>
<!ELEMENT partido (equipo+)>
<!ATTLIST partido id CDATA #REQUIRED>
<!ATTLIST partido hora CDATA #REQUIRED>
<!ELEMENT equipo (nombre, pais)>
<!ATTLIST equipo id CDATA #REQUIRED>
<!ATTLIST equipo puntuacion CDATA #IMPLIED>
<!ELEMENT nombre (#PCDATA)>
=======
<!ELEMENT jornada (partido+)>
<!ATTLIST jornada id CDATA #REQUIRED>
<!ATTLIST jornada fecha CDATA #REQUIRED>
<!ELEMENT partido (equipo+)>
<!ATTLIST partido id CDATA #REQUIRED>
<!ATTLIST partido hora CDATA #REQUIRED>
<!ELEMENT equipo (nombre, pais)>
<!ATTLIST equipo id CDATA #REQUIRED>
<!ATTLIST equipo estado (clasificado|eliminado) "clasificado">
<!ELEMENT nombre (#PCDATA)>
>>>>>>> organizar xml
=======
<!ELEMENT jornada (partido+)>
<!ATTLIST jornada id CDATA #REQUIRED>
<!ATTLIST jornada fecha CDATA #REQUIRED>
<!ELEMENT partido (equipo+)>
<!ATTLIST partido id CDATA #REQUIRED>
<!ATTLIST partido hora CDATA #REQUIRED>
<!ELEMENT equipo (nombre, pais)>
<!ATTLIST equipo id CDATA #REQUIRED>
<!ATTLIST equipo estado (clasificado|eliminado) "clasificado">
<!ELEMENT nombre (#PCDATA)>
>>>>>>> main
<!ELEMENT pais (#PCDATA)>